{
  "composite_schema": "axis4-composite-trust-query-v0",
  "canon_version": "jcs-rfc8785-v1",
  "anchor": {
    "payment_hash": "sha256:2ed186ebc66947eaac6a05a88c7bc096ee07ac11a2c44bb5580bd72b3670f580",
    "action_ref": "10d8a38c01d8672176aa6e5209a368fde3e1831640d69e15283142b35880c2c1"
  },
  "emitter_rows": [
    {
      "source_id": "algovoi.compliance-screening",
      "evidence_type": "regulatory",
      "framework": ["UK MLR 2017", "UK POCA 2002 s.330", "OFSI", "OFAC", "EU/UN sanctions"],
      "anchor": {
        "payment_hash": "sha256:2ed186ebc66947eaac6a05a88c7bc096ee07ac11a2c44bb5580bd72b3670f580",
        "action_ref": "10d8a38c01d8672176aa6e5209a368fde3e1831640d69e15283142b35880c2c1"
      },
      "verdict": "ALLOW",
      "evidence_ref": "https://github.com/x402-foundation/x402/tree/main/fixtures/risk-check-attestation-sample/v0",
      "sig": "ed25519:PLACEHOLDER-algovoi-compliance-screening-demonstration-only"
    },
    {
      "source_id": "nobulex.verascore-evidence-schema-v0.1",
      "evidence_type": "observational",
      "framework": ["verascore-evidence-schema-v0.1"],
      "anchor": {
        "payment_hash": "sha256:2ed186ebc66947eaac6a05a88c7bc096ee07ac11a2c44bb5580bd72b3670f580",
        "action_ref": "10d8a38c01d8672176aa6e5209a368fde3e1831640d69e15283142b35880c2c1"
      },
      "verdict": "ALLOW",
      "evidence_ref": "https://github.com/arian-gogani/nobulex/tree/main/fixtures/bilateral-receipt/v0",
      "sig": "ed25519:PLACEHOLDER-nobulex-bilateral-receipt-demonstration-only"
    },
    {
      "source_id": "vauban.stark-proof-of-payment-conditions",
      "evidence_type": "cryptographic",
      "framework": ["Starknet", "Stwo Circle STARK M31"],
      "anchor": {
        "payment_hash": "sha256:2ed186ebc66947eaac6a05a88c7bc096ee07ac11a2c44bb5580bd72b3670f580",
        "action_ref": "10d8a38c01d8672176aa6e5209a368fde3e1831640d69e15283142b35880c2c1"
      },
      "verdict": "VALID",
      "evidence_ref": "https://github.com/x402-foundation/x402/tree/main/fixtures/bounded-spend-authorization-sample/v0",
      "sig": "stark:PLACEHOLDER-vauban-stark-proof-demonstration-only"
    }
  ],
  "composite_hash": "sha256:5598d3a81ed6ea79ee526df8c43a726059da0175fa385d09438d65cb3dbb664e"
}
